<?xml version="1.0" encoding="UTF-8"?>
<!--Sample XML file generated by XMLSpy v2009 sp1 (http://www.altova.com)-->
<Document xsi:schemaLocation="urn:cnaps:std:saps:2010:tech:xsd:saps.364.001.01 saps.364.001.01.xsd" xmlns="urn:cnaps:std:saps:2010:tech:xsd:saps.364.001.01" xmlns:xsi="http://www.w3.org/2001/XMLSchema-instance">
	<QQryRspn>
		<GrpHdr>
			<MsgId>2010090912345679</MsgId>
			<CreDtTm>2010-09-09T09:30:47</CreDtTm>
			<InstgPty>
				<InstgDrctPty>0000</InstgDrctPty>
				<InstgPty>0000</InstgPty>
			</InstgPty>
			<InstdPty>
				<InstdDrctPty>103100000018</InstdDrctPty>
				<InstdPty>103100000018</InstdPty>
			</InstdPty>
			<SysCd>SAPS</SysCd>
			<Rmk>a</Rmk>
		</GrpHdr>
		<Prttn>
			<TtlNb>1</TtlNb>
			<StartNb>1</StartNb>
			<EndNb>1</EndNb>
		</Prttn>
		<OrgnlGrpHdr>
			<OrgnlMsgId>2010090912345678</OrgnlMsgId>
			<OrgnlInstgPty>103100000018</OrgnlInstgPty>
			<OrgnlMT>saps.363.001.01</OrgnlMT>
		</OrgnlGrpHdr>
		<NPCPrcInf>
			<PrcSts>PR05</PrcSts>
			<PrcCd>CB1I0000</PrcCd>
		</NPCPrcInf>
		<QInf>
			<NbOfTxs>1</NbOfTxs>
			<QInstrInf>
				<MmbId>103100000018</MmbId>
				<OrgnlGrpHdr>
					<OrgnlMsgId>2010090900005678</OrgnlMsgId>
					<OrgnlInstgPty>103100000018</OrgnlInstgPty>
					<OrgnlMT>hvps.141.001.01</OrgnlMT>
				</OrgnlGrpHdr>
				<QInstrTp>QI07</QInstrTp>
				<Amt Ccy="CNY">100.00</Amt>
				<SeqNb>1</SeqNb>
			</QInstrInf>
		</QInf>
	</QQryRspn>
</Document>
